English,Danish
"By shifting the criteria from the regions to the Member States, we can avoid a great deal of problems later on.",Ved at flytte kriterierne med hensyn til regionerne over til medlemsstaterne forhindrer vi en masse problemer i fremtiden.
"Finally, I would like to draw attention to the position of the Central and Eastern European countries.",Til sidst vil jeg henlede opmærksomheden på de mellem- og østeuropæiske landes stilling.
"The report shows that, in general, they are a long way behind EU countries, especially in terms of GDP per capita.","Af betænkningen fremgår det, at de generelt er langt bagefter landene i Den Europæiske Union, navnlig med hensyn til BNP pr. indbygger."
"With the planned accession of a large number of these countries in the foreseeable future, it is a matter of urgency to review the current structural policy.",Med den planlagte tiltrædelse af en lang række af disse lande inden for en overskuelig fremtid er det tvingende nødvendigt at revidere den nuværende strukturpolitik.
I would like to take this opportunity to follow the example of others and call on the Commission to submit proposals for reform sooner rather than later.,Jeg vil derfor i lighed med andre hermed opfordre Kommissionen til snarligt at fremsætte forslag om en reform.
"Mr President, Commissioner, following close scrutiny of this report one cannot escape the conclusion that it was possible to fulfil the stated objective of the structural policy only in part.","Ærede hr. formand, ærede kolleger, hr. kommissær, efter nøje granskning af den foreliggende betænkning når man utvivlsomt frem til den konklusion, at det angivne mål for strukturpolitikken kun kunne opfyldes delvist."
"For example, whilst the disparities between the regions have increased rather than decreased, there has been a certain amount of convergence between the Member States themselves in this respect.","F.eks. er forskellen mellem regionerne snarere blevet større end mindre, medlemsstaterne selv noterer her en vis tilnærmelse."
"Equally, unemployment levels in the worst affected regions barely fell at all, indeed they rose in some cases.","Ligeledes kunne arbejdsløshedstallene i de hårdest ramte regioner næppe reduceres, de er endda til dels steget."
I wonder why it is that the structural funds are not employed more efficiently.,"Jeg spørger altså mig selv, hvorfor strukturfondsmidlerne ikke blev anvendt mere effektivt."
Even the accumulation of money from the cohesion funds and the structural funds has failed to have the desired effect in all regions and countries.,Selv kumulationen af midler fra Samhørighedsfonden og strukturfondene har ikke bragt det ønskede resultat i alle regioner og lande.
"Since it is the declared aim of all politicians throughout Europe to reduce unemployment, then one must pose the critical question as to whether the policy employed is the right one or whether it would not be more appropriate to boost the competitiveness of the regions by appropriate measures such as increased support for research and development, improvements in infrastructure and raising the level of training.","Efter at alle politikeres erklærede mål i hele Europa er blevet en reduktion af arbejdsløsheden, skal man stille sig det kritiske spørgsmål, om den anvendte politik er den rigtige, eller om det ikke er mere hensigtsmæssigt at styrke regionerens konkurrenceevne ved passende foranstaltninger som øget støtte til forskning og udvikling, forbedring af infrastrukturen, forøgelse af uddannelsesniveauet."
Genuine structural reforms and a competition-friendly taxation policy are the cornerstones of a successful economic base.,Seriøse strukturreformer og en konkurrencevenlig skatte- og afgiftspolitik er byggestenene for et vellykket erhvervsområde.
"If we do not wish to stand accused of pursuing a cost-intensive structural policy that does nothing to improve the unemployment situation in the long term, then the measures drawn up so far must be analysed.","Hvis vi ikke vil finde os i at blive bebrejdet, at vi fører en omkostningstung strukturpolitik, som ikke ændrer noget vedvarende i spørgsmålet om beskæftigelse, skal der sættes spørgsmålstegn ved de hidtidige foranstaltninger."
We will only be able to say that the structural policy of the Union has been a success when we manage to create a sufficient number of jobs and when there is a significant reduction in the unemployment rate.,"Unionens strukturpolitik er først vellykket, når det lykkes at skabe tilstrækkeligt med arbejdspladser og at reducere arbejdsløshedskvoten betydeligt."
"Mr President, Commissioner, my thanks go to the rapporteur for handling this very important report, because developments in the social and economic situation will decide to what extent the citizens of Europe will judge that we have been successful in our work.","Hr. formand, ærede kommissær, ærede kolleger, tak til ordføreren for behandlingen af dette meget vigtige emne, idet udviklingen i den socioøkonomiske situation er afgørende for, hvordan Europas borgere mener, at det er lykkedes for os at udføre vores arbejde."
"This issue, which has an impact on their everyday life, is a key issue as regards EU credibility.","Denne sag, som har indflydelse på deres hverdag, er et afgørende spørgsmål med hensyn til EU's troværdighed."
"It has to be conceded that the EU has already aided, I would say quite magnificently, the development of poor countries.","Man må indrømme, at EU allerede har støttet, for ikke at sige på udmærket vis, udviklingen i de fattige lande."
I remember what Portugal and Greece used to be like when I drove through those countries for the first time twenty-five years ago.,"Jeg erindrer, hvordan der så ud i Portugal og Grækenland, da jeg første gang for 25 år siden kørte der."
"In this connection, French speakers would speak of a ""coup de chapeau"" : in other words, I take my hat off to the EU.","I denne forbindelse vil de fransktalende sige ""coup de chapeau"", jeg tager hatten af for EU."
"The EU really deserves such a gesture, but differences between rich and poor areas within countries are still too great.","EU fortjener faktisk denne hæder, men inden for landene er forskellene mellem fattige og velhavende områder stadig for store."
What is the result?,Hvad medfører dette?
People react by voting with their feet and go where they can earn a crust.,"Befolkningen reagerer ved at stemme med deres fødder ved at rejse derhen, hvor der er velstand."
"Consequently, we have to build schools, hospitals, and the whole infrastructure for the same people in the same country many times over.","Det resulterer i, at vi flere gange skal bygge skoler og sygehuse, hele infrastrukturen til den samme befolkning i det samme land."
This is very costly and it also causes very great social problems.,Dette bliver meget dyrt og medfører også særdeles store sociale problemer.
"Most people, however, would like to live in the area in which they were born and raised, if they were given the chance to, in other words, if there was work there.","Den største del af befolkningen vil gerne bo på sin hjemegn, hvis den får mulighed for det, det vil sige, hvis der er arbejde."
We must give them this opportunity.,Vi skal give dem denne mulighed.
This is a moral obligation the EU and all of us have.,Dette er den moralske pligt for EU og for os alle.
"The solution, as I see it, lies in clearly encouraging entrepreneurship.",Jeg ser en klar støtte til iværksætterpotentialet som en løsning.
"By entrepreneurship I do not simply mean the ownership of business, but creating will.","Med iværksætterånd mener jeg bestemt ikke kun at eje en virksomhed, men jeg mener viljepotentialet."
"I mean the attitude where a person wants to get on in life, whether he or she is an employee, the owner of a business or an official.","Jeg mener den indstilling, at mennesket vil fremad i sit liv, uanset om man er arbejdstager, virksomhedsejer eller embedsmand."
What is a fair society?,Hvordan er et retfærdigt samfund?
One in which someone from a modest background can get on in life so as to make life a little easier for his or her children.,"Det er, når et menneske, som kommer fra beskedne forhold, kan komme videre i sit liv, således at hans/hendes børn får det lidt nemmere."
"In this way, positive development of the regions is also possible, because people will start business and will work if they are given the chance.","Sådan er det også muligt at skabe en positiv udvikling i regioner, for befolkningen vil gerne igangsætte og arbejde, hvis den bare får mulighed for det."
"Finally, I would say that in this matter we should learn a lesson from America, where hard work is still in fashion and success is an indication of ability and not the object of envy, as it often is here in Europe.","Jeg vil sige, at vi i denne forbindelse bør tage ved lære af USA, hvor flid stadig er in, og succes er et tegn på kompetence og ikke genstand for misundelse, som det ofte er hos os i Europa."
"Mr President, Commissioner, as my time is limited, I shall get straight to the point.","Hr. formand, hr. kommissær, kære kolleger, eftersom man tæller de sekunder, jeg har til min rådighed, vil jeg gå direkte til sagen."
"Firstly, let me make a statement of fact: the fruits of growth are not distributed equitably within the Union.",Allerførst en konstatering: Afkastet af væksten er ikke delt ligeligt inden for Den Europæiske Union.
"The most remote regions, still hard hit by catastrophic unemployment rates, offer one example of this.","Tag f.eks. regionerne i Fællesskabets yderste periferier, der endnu en gang er ramt hårdt af en meget høj arbejdsløshedsprocent."
"In Reunion, for example, the rate is 37%.",På Réunion er der f.eks. en arbejdsløshed på 37%.
"This is not a situation related to the economic climate, however; rather it is a structural problem, created by our remoteness, our insularity, in short, our own specific personality.","Men dette skyldes ikke konjunkturerne, der er strukturelle årsager hertil."
"The principle of specific, exceptional treatment was envisaged in Article 299(2) of the Treaty of Amsterdam in order to deal with such cases.","Det er vores fjerne beliggenhed, vores status som øregion, kort sagt vores egen personlighed, der skaber denne arbejdsløshed. For at bekæmpe situationen fastsatte man i Amsterdam-traktatens artikel 299, stk."
It only remains to put this principle into practice.,"2, princippet om særlige foranstaltninger."
"The Commission document expected to be ready in December 1999 was delayed until January, then February, and the initial thinking does not fill me with much optimism.","Nu skal vi blot omsætte disse principper til handling. Kommissionens dokument, der blev bebudet til december 1999, er blevet udskudt til januar og dernæst til februar, og de første overvejelser giver ikke ligefrem grund til optimisme."
I therefore appeal formally to the Council and the Commission.,Derfor udsender jeg en højtidelig appel til Rådet og Kommissionen.
"As regards taxation, state aid, the Structural Funds and defending our traditional products, practical measures characterised by daring and ambition must be planned as a matter of urgency.","Med hensyn til skat, statsstøtte, strukturfondene og forsvaret af vores traditionelle produktion er det vigtigt at overveje konkrete foranstaltninger, der er kendetegnet af mod og ambitioner."
"If these do not materialise, then, unfortunately, convergence and cohesion will remain no more than words for us, and it is to be feared that the structural policy undertaken in our regions, despite the size of the amounts committed, will end in failure.","Uden dette vil konvergens og samhørighed desværre blot forblive flotte ord, og man kan frygte, at den strukturpolitik, der føres i vores regioner, vil afsluttes med en fiasko på trods af de store summer, der skydes ind."
"Mr President, as all the previous speakers have done, I should like in turn to thank Mr Berend and congratulate him on the quality of his report.","Hr. formand, nu er det min tur til i lighed med andre talere at takke hr. Berend og lykønske ham for kvaliteten af det arbejde, han har udført."
"Just like the previous report, this extremely competent and precise analysis, the recommendations it supports and your own comments, ladies and gentlemen, shall prove useful to the Commission in general and to the Commissioner responsible for regional policy in particular at this time when we are involved with the programming of appropriations for 2000-2006.","Som det var tilfældet med den foregående betænkning, vil denne meget kompetente og præcise analyse samt de henstillinger, den indeholder, og Deres bemærkninger, mine damer og herrer, være til hjælp for Kommissionen i almindelighed og især for den kommissær, der har ansvaret for regionalpolitikken på et tidspunkt, hvor vi indleder programmeringen af bevillingerne for 2000-2006."
"I should also like to make a few comments, firstly, Mr Berend, regarding the assessment you have made of this sixth periodic report.","Det er min tur til at fremsætte nogle bemærkninger, først og fremmest om Deres bedømmelse, hr. ordfører, af denne sjette periodiske rapport."
"You pointed out the quality of the report and you even wrote, if I am not mistaken, that it marked a real improvement in comparison with previous reports.","De har fremhævet kvaliteten heraf, og De har selv skrevet, hvis jeg ikke tager fejl, at i forhold til den foregående rapport viste den en sand forbedring."
"On behalf of all the officials of the Commission and my predecessor, Mrs Wulf-Mathies, I must inform you that we were very alert to the evaluation made by this House and by yourself.","På vegne af alle Kommissionens funktionærer og min forgænger fru Wulf-Mathies vil jeg gerne sige, at vi har været meget spændt på Europa-Parlamentets og Deres vurdering."
"The Commission was certainly very anxious to ensure, Mr Berend, that this sixth periodic report should show that progress had been made and a threshold crossed in terms of the quality of the analysis submitted to you.","Det er sandt, hr. Berend, at Kommissionen tillægger det særlig betydning, at denne sjette periodiske rapport gør det muligt at konstatere en indsats og en klar kvalitetsmæssig forbedring med hensyn til den analyse, der er foreslået Dem."
"I am thinking in particular of the contents of chapter 2.1 of this report, where the Commission examined in greater detail the economic definitions of regional competitiveness and attempted to analyse the extent to which this competitiveness may be supported, improved and influenced by factors which some of you - Mr Markov, just now, and Mrs Raschhofer - stressed very forcefully.","Jeg tænker navnlig på indholdet i kapitel 2.1 i rapporten, hvor Kommissionen mere omhyggeligt har undersøgt de økonomiske definitioner i forbindelse med den regionale konkurrencedygtighed og har forsøgt at analysere, i hvilken udstrækning denne konkurrencedygtighed skal støttes, forbedres og påvirkes af de faktorer, som nogle af Dem, bl.a. hr. Markov for et øjeblik siden eller fru Raschhofer, kraftigt har understreget."
"I am thinking of technological research and development, infrastructure provision and quality, human resources potential, small and medium-sized businesses and direct investment from abroad.","Jeg tænker på den teknologiske forskning og udvikling, på bevillingerne til eller kvaliteten af infrastrukturen, på de menneskelige ressourcers potentiale, på små og mellemstore virksomheder og på den direkte investering i udlandet."
So much for the quality.,Dette er kvalitet.
"I do not wish to spend time right now, Mr Berend, going into details regarding my opinion of the general points which your House has already endorsed.","Jeg vil ikke komme nærmere ind på min opfattelse af disse generelle punkter, som Europa-Parlamentet allerede har godkendt."
"Let me just itemise them: the first point concerns the usefulness of the conclusions of this report in drawing up the priorities of the new regional policy, particularly for the negotiation of programming documents with the Member States.","Jeg vil blot nævne dem meget kort: Det første vedrører anvendeligheden af konklusionerne i denne rapport med henblik på at udarbejde prioriteter for den nye regionalpolitik, navnlig i forbindelse med forhandlingen med medlemsstaterne om programmeringsdokumenterne."
"Secondly, partnership, a subject which a number of you stressed, the role of local and regional authorities, the private sector, both sides of industry, associations and local community action groups.","For det andet partnerskabet, som flere blandt Dem har fremhævet, de lokale og regionale myndigheders rolle, den private sektor, arbejdsmarkedet parter, foreningssektoren og lokalsamfundene."
"Regarding this problem of partnership, I shall be extremely attentive to ensuring that the terms of the Structural Funds regulations are applied properly.",Jeg vil være yderst opmærksom på den korrekte anvendelse af bestemmelserne i den generelle forordning om strukturfondene med hensyn til dette problem om partnerskaber.
"Thirdly, the need to develop the employment side of growth, even though I am aware, as Mr van Dam just said, that the prime responsibility is that of the Member States, and that, when we speak of the responsibility of Member States, and indeed of the usefulness or effectiveness of this regional policy, we must clearly establish what sort of period we are working in.","Det tredje punkt er behovet for at udvikle indholdet ved brug af væksten, selvom jeg godt ved, hr. van Dam sagde det lige før, at medlemsstaterne har det største ansvar, og at man, når man taler om ansvar hos medlemsstaterne - eller i øvrigt om anvendelsen eller effektiviteten af regionalpolitik - skal tage hensyn til den periode, vi befinder os i."
Mr Fruteau stated just now that the fruits of growth were distributed inequitably.,"Lige før erklærede hr. Fruteau, at afkastet fra væksten er ulige delt."
"Mr Fruteau, we at least need to recognise that there is growth, and that we are not working in a period of stagnation or recession, as has been the case in the past.","Det er dog nødvendigt, hr. parlamentsmedlem, at der er en vækst, og at man ikke på globalt plan befinder sig i en periode med stagnation eller tilbagegang, som det har været tilfældet tidligere."
You will tell me that situations of growth or shortage do not affect everyone alike.,"De mener ikke, at væksten eller nøden er ligeligt fordelt."
I agree with your analysis.,Jeg er enig i Deres analyse.
"When there is growth, it must be better distributed, but a matter that is even more difficult and which more seriously affects the regions handicapped by their remoteness, be they the most remote or island regions, is the lack of growth which generally characterised the last two decades.","Når der er vækst, skal den fordeles bedre, men det, der er endnu mere vanskeligt, og som i endnu højere grad rammer de regioner, der har problemer på grund af deres afsides beliggenhed eller beliggenhed i Fællesskabets yderste periferi eller øregioner, er den manglende vækst gennem de seneste to årtier på globalt niveau."
"Fourthly, a point which Mrs Hedkvist Petersen stressed just now, the promotion of an equal opportunities policy for women and young people.","Det fjerde punkt, som fru Hedkvist Petersen for et øjeblik siden understregede, drejer sig om en politik til fremme af lige chancer for mænd og kvinder og for de unge."
"Fifthly, the importance and role of small and medium-sized businesses.","Det femte punkt drejer sig om de små og mellemstore virksomheders roller og betydning, hr."
Mr Vatanen expressed this most forcefully just now.,Vatanen sagde dette med stor overbevisning for et øjeblik siden.
"Finally, the positive effects on national administrations of the system of management of the Structural Funds, the motives of officials in managing these funds, even if it is occasionally complicated, and the importance of once again making improvements to the procedures for the evaluation, follow-up and supervision of the Commission.","Til sidst de positive effekter for den nationale administration i forbindelse med forvaltningen af strukturfondene, funktionærernes bevæggrunde i forbindelse med forvaltningen af disse fonde, selvom det nogle gange er svært, og det vigtige i igen at forbedre Kommissionens vurderingsprocedurer og kontrolprocedurer."
"In relation to this, I must inform the European Parliament of my intention to organise halfway through the year 2000 a seminar with national and regional authorities on this question of the evaluation of procedures for the exchange of good practice in the management of Structural Funds.",Jeg informerer i denne forbindelse Europa-Parlamentet om min hensigt om at organisere et seminar i midten af 2000 med deltagelse af de nationale og regionale myndigheder om vurdering af procedurerne til udveksling af god praksis inden for forvaltningen af strukturfondene.
I should like to mention a few specific points.,Jeg vil gerne nævne nogle specifikke punkter.
"Mr Berend, you expressed a wish that zoning should be implemented quickly.","Hr. Berend, De har ønsket, at planen over støtteområder udarbejdes hurtigst muligt."
"Well, we are coming to an end of the zoning phase.",Vi er ved at være færdige med denne opdeling.
"Tomorrow, the Commission is to decide on the matter for four more countries and very soon, I hope, it will be Italy' s turn.","I morgen træffer Kommissionen afgørelse med hensyn til fire nye lande, og turen vil meget snart - håber jeg - komme til Italien."
"You may therefore be satisfied on this point, since zoning will have been completed for all the countries affected by Objective 2.","Deres ønsker på dette punkt vil således blive opfyldt, eftersom alle landene under mål 2 vil blive inddelt i områder."
"Regarding the informal economy you mention in your report, I am well aware that the analysis and production of statistics on this subject are dependent on the reliability of data and, as Mr Cocilovo mentioned, there is clearly a problem with the reliability of this data.","Med hensyn til den undergrundsøkonomi, som De henviser til i Deres betænkning, ved jeg godt, at analysen og udarbejdelsen af statistikken i denne forbindelse er afhængig af oplysningernes troværdighed, og som hr. Cocilovo har nævnt, er der et troværdighedsproblem med hensyn til oplysningerne."
"To a certain extent, they are taken into account in the statistics on GDP and labour force surveys and, in any case, I wish to point out the efforts which Eurostat is making and shall continue to make in order to improve the quality of the statistics.","I en vis udstrækning tages de igen i betragtning i statistikkerne om BNP, undersøgelserne om arbejdsstyrken, og under alle omstændigheder vil jeg gerne understrege, at Eurostat forbedrer og fortsat vil forbedre statistikkernes kvalitet."
"Mr Berend, you also mentioned, as did Mr Aparicio Sánchez, the lack of reform in the fisheries sector.","De nævnte ligeledes, hr. Berend, i lighed med hr."
"On this point which is of personal interest to me, let me remind you that the small scale of this sector - and this does not necessarily mean that it is an insignificant area - and its concentration in a limited number of regions do not make it easy to analyse in a regional context.","Aparicio Sánchez, den manglende reform af fiskerisektoren. Med hensyn til dette punkt, som interesserer mig personligt, vil jeg gerne minde om, at sektorens ringe omfang - hvilket ikke betyder, at den er ubetydelig - og det faktum, at den er koncentreret i meget få regioner, ikke letter en regional analyse."
"This type of sectoral analysis pertains rather to the practice and competence of the Directorate General for Fisheries, under Commissioner Fischler.","Denne form for sektoranalyse henhører snarere under generaldirektoratet for fiskeri, som min kollega hr. Fischler er ansvarlig for."
"Nonetheless, I must assure you that the Commission will make every effort to include an analysis of this type in the second report on cohesion which, no doubt, will respond better to these concerns.","Dog vil jeg gerne forsikre Dem om, at Kommissionen vil gøre alt for at medtage en sådan analyse i den 2. rapport om samhørighed, som uden tvivl vil omhandle disse bekymringer."
"Several of you mentioned points which must be included in the second report on cohesion, and your rapporteur mentioned some of these.","Der er flere blandt Dem, der har nævnt disse punkter, som skal medtages i den 2. rapport om samhørighed, og Deres ordfører har nævnt nogle af disse punkter."
