English,Danish
"Firstly, we need to make the best possible use of consultation as a means of ensuring proper coordination and participation by all local and regional operators in decision-making, precisely so that imbalances and inequalities can be avoided.","For det første er det nødvendigt at gøre bedst muligt brug af samrådsproceduren som metode til koordinering og til inddragelse af alle de lokale og regionale aktører i beslutningerne, netop for at undgå ubalance og uligheder."
"Secondly, a genuine effort is required to make administrative procedures simpler and more transparent, since, they are all too often unnecessarily lengthy and complicated, to the point of hindering access to the Funds. This is something about which European small and medium-sized businesses, in particular, tend to complain.","For det andet er det nødvendigt med en sand forenkling af og gennemsigtighed i de administrative processer, som alt for ofte er unødigt lange og så komplekse, at det går ud over adgangen til fondene, hvilket navnlig de små og mellemstore europæiske virksomheder beklager sig over."
"I will conclude, Mr President, by saying that the failure of the Commission' s communication to focus on territorial pacts and, especially, methods of combating unemployment among women and young people, is cause for serious concern.","Afslutningsvis vil jeg gerne sige, hr. formand, at det er ret alvorligt, at der i Kommissionens meddelelse er gjort så lidt ud af de regionale og lokale beskæftigelsespagter og ikke mindst af metoderne til bekæmpelse af arbejdsløsheden blandt kvinder og unge."
"Mr President, like my colleague Mr Evans, it is a particular pleasure to rise and make my first speech to this House on this very important issue, especially since I represent a part of the United Kingdom, the West Midlands, which has hitherto benefited from Objective 2 funding in particular.","Hr. formand, jeg føler som min kollega, hr. Evans, en særlig glæde over at kunne holde min første tale i Parlamentet om dette meget vigtige spørgsmål, især da jeg repræsenterer en del af Det Forenede Kongerige, West Midlands, som tidligere har haft glæde af mål 2-støtte."
"But the report before the House tonight is a prime example of how, if we are not very careful, we can produce very grandiose-sounding ideas that lack the substance to make them relevant to the people who benefit directly from them.","Men betænkningen til forhandling i Parlamentet i aften er et førsteklasses eksempel på, hvordan vi, hvis vi ikke passer på, skaber idéer, der lyder fantastiske, men som ikke har den fornødne substans til at gavne de relevante personer."
"The report itself is well-intentioned but, as so often when we deal with these issues, lacks clarity of purpose and a sound basis for operability.","Hensigten med betænkningen er god, men den mangler - som så ofte i forbindelse med disse spørgsmål - tydeligt mål og grundlag for handling."
"That is why I and my Group are proposing three key amendments and additions to the text, not to take anything away from the proposal, but to make it more relevant to those whom it is there to guide.","Derfor foreslår min gruppe og jeg tre vigtige ændringsforslag og tilføjelser til teksten, ikke for at fjerne noget fra forslaget, men for at gøre det mere relevant for de personer, som det henvender sig til."
I would like to explain our thinking here.,Jeg vil gerne forklare vores tankegang.
"Firstly, we are concerned with the proper use of the Structural and Cohesion Funds.",Vi er først og fremmest optaget af den rette anvendelse af strukturfondene og Samhørighedsfonden.
"Past experience dictates that, as the elected representatives of the European taxpayer, we should, and indeed must, demand financial probity and transparency in the disbursement and auditing of this money, hence our amendments and additions relate to achieving what are known as ""value for money"" indicators in the grant-giving process.","Tidligere erfaringer viser, at vi som valgte repræsentanter for de europæiske skatteydere bør og skal kræve økonomisk redelighed og gennemsigtighed i fordelingen og revisionen af disse midler. Derfor ønsker vi med vores ændringsforslag og tilføjelser at ""få noget for pengene"" i forbindelse med uddeling af midler."
"Next, we all too often see vast sums of money being spent on projects whose outcomes will necessarily be unclear at the start of the programme period.","Endvidere ser vi alt for ofte, at store beløb bruges på projekter, hvis udbytte nødvendigvis vil være uklart i begyndelsen af programperioden."
But at the mid-way point or end of that period there is no effective way of terminating the project if it has not proved successful.,"Men der er ingen effektive måder, hvorpå man kan afslutte et projekt, der ikke er en succes, i midten eller afslutningen af perioden."
"Our additions therefore call for the provision of practical enforceable exit strategies so that not only can we have the requisite insurance against ongoing costs which are often loaded onto the taxpayer, but we also avoid the well-rehearsed syndrome of throwing good money after bad.","Vores tilføjelser indeholder derfor en anmodning om praktisk mulige afslutningsstrategier, så vi ikke blot får den fornødne sikring mod fortsatte omkostninger, der oftest pålægges skatteyderne, men også undgår at smide penge ud af vinduet."
"Finally, we call for a change to the balance and method by which the funds are disbursed.",Endelig anmoder vi om en ændring af balancen og metoden til fordeling af midlerne.
There should be greater involvement of the private sector which will introduce financial reality as a perspective within the funding equation.,"Der bør fokuseres mere på den private sektor, som kan skabe økonomiske realiteter som et perspektiv i støtteligningen."
"Also the type of project funded needs to be shifted away from small-scale revenue-based projects, which are hard to monitor, towards capital schemes where, in the majority of cases, the benefits are there for all to see.","I forbindelse med udvælgelsen af de projekttyper, der støttes, skal der fokuseres mindre på små indtægtsbaserede projekter, der er vanskelige at overvåge, og mere på kapitalordninger, hvor fordelene i de fleste tilfælde er tydelige."
That way the much-trumpeted need for transparency in the use of these funds and the temptation to draw unnecessarily in the longer term on the local tax base in areas where such projects are located will be diminished and the European Parliament will show how seriously it takes the need for such reform.,"På den måde mindskes det ofte fremhævede behov for gennemsigtighed i forbindelse med anvendelsen af disse fonde og fristelsen til i det lange løb at trække unødvendigt på skatteyderne i de områder, hvor sådanne projekter forefindes, og Europa-Parlamentet kan vise, hvor alvorligt det ser på behovet for en sådan reform."
"If these changes to the report are supported by the House today, I believe that they will move us forward in the next phase of achieving the historic objectives which the funds were set up to bring about, namely to assist - in a financially sustainable manner - those deprived areas of the European Union which need to be brought up to a decent standard of living, not by giving a hand-out but by giving a ""hand-up"".","Hvis disse ændringer til betænkningen støttes af Parlamentet i dag, mener jeg, at vi vil være endnu et skridt nærmere opnåelsen af de historiske målsætninger, som fondene blev etableret med henblik på, nemlig - økonomisk - støtte af Den Europæiske Unions dårligt stillede områder, der har behov for at opnå en anstændig levestandard, ikke ved at vi giver dem en håndøre, men en ""håndsrækning""."
I urge the House to support these changes.,Jeg vil gerne anmode Parlamentet om at støtte disse ændringer.
"Mr President, Commissioner, I too would like to commend the rapporteur on her report, which is a meticulous and substantive piece of work.",". (EL) Hr. formand, hr. kommissær, ærede medlemmer, jeg vil også gerne gratulere ordføreren for hendes betænkning, som er et møjsommeligt og seriøst stykke arbejde."
"The European Union' s structural and cohesion policies are, without doubt, essential tools for creating the right conditions with a view to tackling and reducing the levels of economic and social disparity between the regions.","Der hersker ikke nogen tvivl om, at EU's strukturpolitikker og samhørighedspolitik udgør de basale redskaber til at skabe forudsætningerne for udvikling og for at formindske de økonomiske og sociale uligheder mellem regionerne, som til trods for de skridt, som allerede er taget, fortsat ligger på et højt niveau."
"Despite the steps taken thus far, these levels are still very high, and are unacceptably high as regards unemployment.",I forbindelse med arbejdsløsheden på et uacceptabelt højt niveau.
These policy objectives can only be achieved through their careful coordination and organisation on the basis of well thought-out and sensible guidelines.,"For at målene for disse politikker i højere grad kan nås, er det nødvendigt at koordinere dem og organisere dem på basis af godt gennemarbejdede, man kunne sige kloge, retningslinjer."
"Let us not forget that when these policies are effective, they also benefit European citizens by directly improving their quality of life.","Vi må ikke glemme, at det er tydeligt for den europæiske borger, når disse politikker er effektive, for han kan straks se en forbedring af sin livskvalitet."
"Let us not forget either that greater consideration should be given to the islands and remote regions of the European Union because their geographical location is a hindrance to their economic and social development, unless of course the Commission is intending to build bridges or underwater tunnels linking them to the European mainland.","Vi må ligeledes heller ikke glemme, at vi bør lægge særlig vægt på de fjerne egne og øerne i EU, for de møder fundamentale forhindringer i deres økonomiske og sociale udvikling på grund af deres geografiske placering, medmindre naturligvis Kommissionen har til hensigt at bygge broer eller undersøiske tunneller og forbinde dem med det europæiske fastland."
"In closing, I would like to point out that the structural policies as a whole require greater flexibility so that they can adapt to changing circumstances and thereby respond to the new challenges and opportunities of the new millennium, for which we all hope for the best.","Til sidst vil jeg gerne betone, at strukturpolitikkerne generelt bør være mere smidige, så de kan tilpasses de ændrede forhold og svare til de nye udfordringer og muligheder, som dukker op med det nye årtusindes komme, i forbindelse med hvilket jeg ønsker alle alt godt."
"Mr President, Mrs Schroedter' s report undoubtedly contains several important observations, and I would like to congratulate her on that.","(GUE/NGL). (EL) Hr. formand, fru Schroedters betænkning indeholder uden tvivl mange vigtige bemærkninger, og jeg vil gerne komplimentere hende med den."
"However, I feel that we should be a little more concerned about the actual direction and outcome of the Community' s regional policy.","Men jeg er af den mening, at vi i højere grad burde være mere urolige over retningen og resultaterne af Fællesskabets regionalpolitik."
"Quite briefly, structural policy does not ease the problem of mass unemployment in any way, rather it aggravates it.","Sagt ganske kort, så falder den uhyrlige massearbejdsløshed ikke, men tværtimod skærpes den yderligere inden for rammerne af strukturpolitikken."
"The agricultural economy and agricultural regions have been irreparably damaged by the existing regional policy, which has had dramatic consequences on employment levels in rural areas and on the living conditions of farmers, particularly in the South.","Landbrugsøkonomien og landbrugsområderne lider uoprettelig skade af den førte regionalpolitik med dramatiske følger for beskæftigelsen i landdistrikterne og for bøndernes livsbetingelser, især i Syden."
Regional disparities are becoming much more marked within the Member States.,De regionale uligheder uddybes dramatisk inden for medlemsstaterne.
"If we examine the data presented in the sixth periodic report, we will see that the last decade has witnessed a proliferation of regional disparities.","Hvis vi betragter dataene i den sjette rapport, vil vi se uhyrlige afvigelser med hensyn til regionale uligheder gennem de sidste 10 år."
"Little consideration, if any at all, has been given to the great problems facing the island regions of the Union whose shortcomings as regards infrastrucutres structure, transport, communication and energy has resulted in their gradual depopulation.","Man har kun vist ganske lille, om overhovedet nogen som helst, opmærksomhed på de uhyrlige problemer i Unionens øegne, hvor mangler inden for infrastruktur, transport, kommunikation og energi fører støt til en affolkning."
The Union' s economic and social policy is just as much to blame for that as its regional policy.,Ansvarlig for alle disse ting er såvel Unionens regional- som den mere generelle økonomi- og socialpolitik.
A large section of the Union' s population has strongly condemned this policy for being dangerous and anti grass-roots.,Store dele af Unionens borgere fordømmer intenst denne politik som farlig og folkefjendsk.
"Unfortunately, the new guidelines seem to be heading in the same direction and there are no signs that things will change once they have been implemented.","De nye retningslinjer bevæger sig desværre i samme retning, og der er intet, der tyder på, at den kan ændres med disse retningslinjer."
"Mr President, I would like to say a few words in order to highlight two points made in these reports which are of fundamental strategic importance to the way we see the Union.","Hr. formand, kære kolleger, jeg beder Dem om lov til at sige et par ord for at understrege to punkter, som disse betænkninger minder os om, og som har en væsentlig strategisk betydning for den opfattelse, vi har af Unionen."
"The first is the fundamental, central importance that we continue to give to the principle of economic and social cohesion.","Det første er den væsentlige og centrale betydning, som vi stadig tillægger princippet om økonomisk og social samhørighed."
We are concerned to hear news that the Commission is taking this objective less seriously.,"Og vi giver udtryk for bekymring på grund af meddelelser om, at betydningen af dette mål bliver mindre i Kommissionens bevidsthed."
We still feel that economic and social cohesion is one of the Union' s fundamental objectives.,"Vi synes fortsat, at økonomisk og social samhørighed er et centralt mål for Unionen."
"Secondly, I agree with what has already been said on the issue of the islands and I would also like to bring the outermost regions to your attention.","For det andet er jeg enig i de ting, som en kollega allerede har sagt om spørgsmålet om øerne, og jeg vil også gerne henlede opmærksomheden på regionerne i Fællesskabets yderste periferi."
"In future, we would like to see greater ambition applied to the subject of the outermost regions such as, in my country, the islands of the Azores and Madeira.","Det ville glæde os i fremtiden at se mere vovemod i behandlingen af spørgsmålet om regionerne i Fællesskabets yderste periferi, som det i mit land er tilfældet med Acorerne og Madeira."
"I would like to ask if the Commission is able to enlighten us on the reasons for the delay in the Commission' s report on the outermost regions, which has been long awaited by Parliament?","Jeg benytter denne lejlighed til at spørge Kommissionen, om den kan forklare os baggrunden for forsinkelsen i Kommissionens beretning om regioner i Fællesskabets yderste periferi, som Parlamentet har ventet på i temmelig lang tid."
"Mr President, first of all I would like to thank the rapporteur, not least for being willing to include in the report the suggestions we made.","Hr. formand, først tak til ordføreren, også for den beredvillige optagelse af vores idéer i betænkningen."
"Mr President, Commissioner, the guidelines are intended to help steer the Member States towards achieving the reform objectives contained in the programmes.","Hr. formand, mine ærede damer og herrer, hr. kommissær, ved hjælp af retningslinjer skal medlemsstaterne tilbydes en orientering om, hvordan de når reformmålene inden for rammerne af programmeringen."
"However, contrary to their claim to provide guidance, the Commission' s proposals in this respect are reminiscent to a far greater extent of a catalogue of possible measures within the scope of the various policy areas.",Kommissionens mål i den forbindelse er imidlertid imod dets eget krav om orientering snarere et udbudskatalog over mulige foranstaltninger på de politiske områder.
"Nonetheless, their true purpose is to give direction and to set priorities.",At angive retningen og foretage prioriteringer er dog dens egentlige hensigt.
"I agree with the rapporteur that unfortunately the Commission document contains too little in the way of recommendations to the Member States on simplifying administration, and I support the calls for negotiations to concentrate on promoting a favourable climate for labour-intensive, small and medium-sized enterprises, on setting clear objectives for alternative sources of financing including provisions for risk capital and private financing, and on start-up help for companies including new information technologies and investment in innovative fields.","Jeg er enig med ordføreren i, at Kommissionens dokument desværre indeholder for få henstillinger til medlemsstaterne vedrørende forenkling af forvaltningsstrukturerne, og jeg understreger krav som koncentration under forhandlingerne om støtte til et gunstigt område for arbejdsintensive små og mellemstore virksomheder, om en klar målsætning for alternative finansieringskilder inklusive bestemmelser om risikovillig kapital og privat finansiering, om iværksætterydelse inklusive ny informationsteknologi samt om investeringer på innovative områder."
"I am particularly in favour of a proposed amendment tabled by my Group to paragraph 10, to ensure an appropriate level of private sector involvement in the planning and implementation of the projects.","Min særlige støtte gælder et ændringsforslag fra min gruppe til nr. 10, der skal sikre en rimelig inddragelse af den private sektor ved planlægningen og gennemførelsen af projekter."
"I should be very grateful, Mrs Schroedter, if you would actually include this proposed amendment in the part relating to subsidiarity in your positive deliberations.","Det ville glæde mig, fru Schroedter, hvis De ville medtage dette ændringsforslag under aspektet om nærhed i Deres positive betragtninger."
"Mr President, Commissioner, in the Committee on Employment and Social Affairs, we upheld unanimously the criterion that it was of strategic importance and a matter of priority to support the interventions of the Structural and Cohesion Funds which are working for a better opportunity for jobs for the unemployed and for equality between men and women.","Hr. formand, hr. kommissær, i Udvalget om Beskæftigelse og Sociale Anliggender var vi enige i det synspunkt, at det var strategisk og meget vigtigt at støtte de tiltag i strukturfondene og Samhørighedsfonden, der arbejder for at forbedre beskæftigelsesmulighederne for de arbejdsløse og for lighed mellem kvinder og mænd."
"Unfortunately, the excellent Schroedter report did not take account of this criterion, despite the fact that there is considerable evidence to show - as we shall see later in the Berend report - how, in fact, these funds are providing splendid assistance to the most backward regions in order to bridge the gulf that separates them from Europe' s most highly-developed regions.","Desværre er dette synspunkt ikke inddraget i den udmærkede Schroedter-betænkning til trods for, at der er mange beviser på - og det vil vi se senere i Berend-betænkningen - at fondene rent faktisk hjælper de mindre udviklede regioner glimrende med at mindske den afstand, der adskiller dem fra de mere udviklede regioner i Europa."
"They are growing, but only in terms of GDP.","De har vækst, men regnet i BNP."
They are increasing in competitiveness but they are not all experiencing an increase in wealth because there is no increase in employment and there are still differences in employment opportunities between regions.,"Deres konkurrenceevne øges, men velstandsstigningen når ikke ud til alle, for beskæftigelsen stiger ikke, og der er stadig forskel på beskæftigelsesmulighederne i de forskellige regioner."
"Commissioner, please read the opinion of the Committee on Employment and Social Affairs and treat it as a matter of priority, because this is our citizens' greatest problem.","Hr. kommissær, læs udtalelsen fra Udvalget om Beskæftigelse og Sociale Anliggender, og giv den høj prioritet, for dette er borgernes store problem."
"Please take account, in strategic terms, in the revision and in the allocation of reserves, of employment needs, because this, fundamentally is what the Structural Funds and the Cohesion Funds require.","Tag ved revisionen, ved tildelingen af midler, strategisk hensyn til beskæftigelsesbehovene, for det er, når alt kommer til alt, hvad strukturfondene og Samhørighedsfonden kræver."
"Mr President, it is important that the guidelines head in the right direction and that they guarantee the effectiveness of the programmes of the crucial seven-year period 2000-2006 so as to ensure sustainable development and job creation, particularly for women and young people, and ensure a balance is struck between economic and social policy and regional policy.",". (EL) Hr. formand, det er nødvendigt, at retningslinjerne kan lede programmerne for denne kritiske syvårige periode 2002-2006 i rigtig retning og styrke deres effektivitet, så en bæredygtig udvikling, en styrkelse af beskæftigelsen især for kvinderne og de unge endelig kan blive praksis, og så vi kan sikre en balance mellem økonomi-, social- og miljøpolitikken."
"It is particularly important to address those serious issues concerning urban areas, employment in rural areas, aid to agricultural regions and equal development opportunities for the islands of the European Union and for the Greek islands which, of course, comprise half of the islands of the Union, as stipulated in Article 158 of the Treaty.","Det er særligt vigtigt, at vi gør noget ved de skærpede problemer i byerne, at vi bevarer beskæftigelsen på landet, at vi styrker landdistrikterne, og selvfølgelig at vi skaber lige udviklingsbetingelser for øerne i EU, og naturligvis for de græske øer, som udgør halvdelen af Unionens øer, sådan som der står i artikel 158 i Amsterdam-traktaten."
Cohesion policy needs to be strengthened further because a Europe which totally disregards the standard of living in its regions can neither be reliable or viable.,"Samhørighedspolitikken skal styrkes yderligere, for et Europa med voldsomme uligheder i levestandarden mellem de forskellige egne er hverken troværdigt eller levedygtigt."
"Mr President, ladies and gentlemen, I would like to express my great interest in listening carefully to the comments, occasional criticisms and suggestions that some of you have just made in your speeches with reference to Mrs Schroedter' s report.","Hr. formand, ærede parlamentsmedlemmer, jeg har med stor interesse og opmærksomhed lyttet til de til tider kritiske bemærkninger og forslag, som mange blandt Dem netop har fremsat i Deres indlæg i forbindelse med fru Schroedters betænkning."
"Everyone understands, Mrs Schroedter, ladies and gentlemen, the reasons and the time limits involved - and I shall come back to this point presently - and whatever the time limits or delays, since we are discussing this report right now, as the representative for the Commission, I consider that the report has been issued at an opportune moment with regard to the guidelines for 2000-2006 as it is now that we are starting the new regional programming.","Alle forstår - fru ordfører, mine damer og herrer - grundene, fristerne - det vender jeg tilbage til om et øjeblik - men uanset disse frister eller forsinkelser mener jeg på vegne af Kommissionen, eftersom det er nu, vi forhandler om denne betænkning, at den kommer i rette tid, hvad angår retningslinjerne for 2000-2006, fordi det er nu, vi indleder den nye regionale programmeringsperiode."
"Mrs Schroedter, you quite rightly pointed out that while it is chiefly up to the Member States and the regions to define their own priorities in development matters, European Union cofinancing of the programmes requires, and is the justification for, a situation where Community priorities as debated and approved in this House should also be taken into account in order to promote this Community aspect of economic and social cohesion which many of you forcefully pointed out.","Fru ordfører, De mindede med rette om, at selvom det primært er medlemsstaternes og regionernes opgave at fastsætte deres egne prioriteter med hensyn til udvikling, kræves det i de programmer, som Den Europæiske Union medfinansierer, at der også tages hensyn til Fællesskabets hovedmålsætninger i den udformning, de forhandles og vedtages her i Europa-Parlamentet med henblik på at fremme den økonomiske og sociale samhørigheds fællesskabsdimension, som mange af Dem kraftigt har understreget."
