English,Danish
"The proposal to be discussed today, to amend the directive on the transport of dangerous goods by road, dates from May 1999, however, and could not therefore take account of the latest comitology procedure.","Det forslag, som står til diskussion i dag, om en ændring af direktivet om transport af farligt gods ad vej stammer imidlertid fra maj 1999 og kunne således ikke tage højde for den aktuelle komitologiprocedure (forskriftsprocedure)."
Two of the amendments tabled and adopted unanimously by the committee relate precisely to this amended comitology procedure.,"De fremsatte ændringsforslag, som blev godkendt enstemmigt af udvalget, vedrører i to tilfælde netop denne ændrede komitologiprocedure."
We would like to ensure that there is a reference to this as early as the recitals and that the period within which the Council has to make a decision - which is not clearly worded - is set at a maximum of three months.,"Vi ønsker at sikre, at der henvises hertil allerede i betragtningsgrundene, og at den tvetydigt formulerede frist, inden for hvilken Rådet skal træffe en afgørelse, fastsættes til maksimalt tre måneder."
"In addition, the need for greater transparency has been pointed out.","Desuden henvises der til, at det er nødvendigt med en større gennemskuelighed."
"A further amendment allows the Member States to impose more stringent requirements, in particular for vacuum tanks, if work is done or goods are transported as a priority in temperatures well below -20ºC.","Et andet ændringsforslag gør det muligt for medlemsstaterne at formulere strengere krav, især hvad angår vakuumtanke, hvis der fortrinsvis arbejdes eller transporteres ved temperaturer langt under -20ºC."
This is in the special interest of northern European regions.,Dette er især i nordeuropæiske regioners interesse.
A final amendment is intended to ensure that tanks and tankers put into service between 1 January 1997 and the entry into force of this directive may continue to be used provided that they have been constructed and maintained in accordance with it.,"Et sidste ændringsforslag skal bevirke, at anvendelsen af de tanke og tankbiler, der er taget i brug mellem den 1. januar 1997 og det tidspunkt, hvor dette direktiv træder i kraft, også er tilladt fremover, hvis de er rigtigt konstrueret og vedligeholdt."
"I do realise that this is only a small step towards increased transport safety, but I would ask you to endorse this report.","Vel vidende, at dette kun er et lille skridt i retning mod større trafiksikkerhed, anmoder jeg Dem om at godkende denne betænkning."
"Mr President, colleagues, a happy new year and millennium to you all.","Hr. formand, kære kolleger, godt nytår og millennium."
"I am speaking for the first time in this plenary part-session, so this is quite exciting for me, a little like first love, although that did last longer than two minutes.","Jeg taler for første gang på plenarmødet, så det er spændende, næsten lidt som den første kærlighed, men den første kærlighed varede dog længere end to minutter."
I would like to briefly comment on the Commission' s proposal to amend the directive on the transport of dangerous goods by road.,Jeg vil kort kommentere Kommissionens forslag til ændring af direktivet om transport af farligt gods ad vej.
"It is good that this directive should be established now, as, otherwise, Member States would have to amend their national acts for a very short time, a period of transition, which would again mean unnecessary costs and which would once more increase concern with regard to EU bureaucracy.","Det er godt, at dette direktiv udarbejdes nu, for ellers skal medlemsstaterne ændre deres nationale bestemmelser for en meget kort tid, i overgangsperioden, hvilket igen vil medføre unødvendige omkostninger og endnu en gang øge folks irritation over bureaukratiet i EU."
"The Commission' s proposal, however, does not take account of all the facts, such as the cold climate that prevails in the northern regions.","Kommissionens forslag tager imidlertid ikke højde for alt, f.eks. de nordlige regioners kolde klima."
"Consequently, I have tabled some amendments to Mr Koch' s intrinsically excellent report, which have been adopted by our committee.","Således har jeg fremsat nogle ændringsforslag, der er vedtaget i vores udvalg, til denne for øvrigt udmærkede Koch-betænkning."
My amendments concern the frost-resistance ratings for tankers carrying these dangerous goods.,Mine ændringsforslag drejer sig om frostbestandigheden af tanke til transport af farligt gods.
According to the Commission' s proposal -20ºC would have been sufficient.,Efter Kommissionens forslag er -20C tilstrækkeligt.
"On the shores of the Mediterranean, it is hard to imagine that in Lapland temperatures can fall considerably lower than that.","Det er svært ved Middelhavet at forestille sig, at frosten i Lapland når betydeligt længere ned."
"There is support for the EU in Lapland also, so let us remember them.","EU bliver bakket op også i Lapland, så lad os huske dem."
I have thus proposed that the frost rating be lowered to -40ºC.,Jeg har derfor foreslået frostgrænsen sat ned til -40C.
This would be necessary to keep safety standards at the level they were in northern regions previously.,Dette er nødvendigt for at bevare det eksisterende sikkerhedsniveau i de nordlige regioner.
I hope my proposal will be taken into consideration in tomorrow' s vote.,"Jeg håber, at der tages højde for mit forslag ved afstemningen i morgen."
"Mr President, with your permission I should like to begin by expressing my admiration for the way in which you executed the quick changeover of the chairmanship just now during the debate.","Hr. formand, hvis De tillader det, vil jeg gerne starte med at udtrykke min respekt for den måde, som De klarede det flyvende skifte i forsædet på under debatten før."
I thought that it was quite superb.,Efter min mening var det fremragende.
"On the subject at hand, I think that the people of Europe must be able to be confident that the goods - however dangerous they are - which are transported on Europe's roads, railways, and so on are as safe as possible.","Til selve emnet: Jeg mener, at Europas borgere skal kunne stole på, at det, som transporteres på Europas veje, jernbaner osv., hvis der da er tale om farligt gods, er så sikkert som muligt."
This directive is a contribution to this.,Dette direktiv er et bidrag hertil.
What we are doing today is essentially a nuisance.,"Det, vi gør i dag, er i grunden ærgerligt."
"The rapporteur, Mr Koch, to whom we express our thanks for the work which he has done on this, has already pointed out that basically everything could have been somewhat more advanced had it not been for the inactivity on the part of the CEN, which has been very dilatory in drawing up and adapting the directive.","Ordfører Koch, som vi takker for det arbejde, han har udført i den forbindelse, har påpeget, at alt egentlig allerede kunne være kommet et skridt videre, hvis ikke CEN havde forsømt sådan, hvilket giver meget nøl i udarbejdelsen og tilpasningen af direktivet."
"That is why we can only hope - and we should resolve all of this this week - that, in 2001, we will finally have Community regulations for the transport of dangerous goods by road so that we have a degree of legal certainty here and also so that our roads are a good deal safer.","Derfor kan vi kun håbe - og vi bør beslutte det hele i denne uge - at vi langt om længe har fælles regler for transport af farligt gods ad vej i 2001, således at vi får retssikkerhed og også større sikkerhed på vores veje på dette område."
"Mr President, the report we are discussing here does not, in itself, entail any major changes.","Hr. formand, den betænkning, som vi behandler her, medfører i sig selv ingen store forandringer."
Most of the proposed amendments are of a purely technical nature.,De fleste af ændringsforslagene er af ren teknisk art.
"It is nonetheless worth emphasising that, each time we make this type of decision, it is good from a broad environmental perspective and it is beneficial because it creates better prior conditions for exploiting the possibilities of the internal market.","Det er dog værd at understrege, at hver gang vi tager en sådan beslutning, er det godt ud fra et bredt miljøperspektiv, og det er godt, fordi det skaber bedre forudsætninger for, at det indre marked kan fungere."
"Very large quantities of dangerous goods are transported around the EU, both on roads and railways and by sea.","Rundt omkring i EU transporteres der meget store mængder farligt gods ad vej, vandvej eller med jernbane."
This makes it necessary to have proper rules governing transport of this kind.,"Det er derfor nødvendigt med klare regler for, hvordan dette skal foregå."
"In area after area, we are now obtaining common minimum regulations for the Member States.",På flere og flere områder indfører vi fælles minimumsregler for medlemslandene.
"This is extraordinarily positive, and there is cause to thank the rapporteur, Mr Koch, for the work he has put in on this issue.","Det er meget positivt, og det giver anledning til at takke ordføreren, Koch, for det arbejde, som han har udført."
This is also important where the prerequisites for the internal market are concerned.,"Dette er også vigtigt, når det drejer sig om forudsætningerne for det indre marked."
"If we are to get a common transport market genuinely up and running, it is important that we should not only have regulations but that these regulations should also, as far as possible, apply to every country.","Hvis vi skal få et fælles transportmarked til at fungere godt, er det vigtigt, at vi ikke bare har regler, men også at disse regler så vidt muligt er fælles regler."
"I should like to conclude by commenting on a third matter which is also of significance, namely an amendment tabled by Member of Parliament, Mr Ari Vatanen.","Til sidst vil jeg gerne kommentere en tredje sag, som også er vigtig, nemlig et ændringsforslag fremsat af parlamentsmedlem Ari Vatanen."
"In many ways, the prerequisites differ from one Member State to another.",Forudsætningerne er forskellige fra medlemsland til medlemsland.
"By approving this amendment, we take account of the fact that it can be very cold in the northern parts of the European Union.","Ved at godkende dette ændringsforslag tager vi højde for, at det kan være meget koldt i de nordlige dele af Unionen."
This makes it necessary to also take account of the ways in which materials and packaging are affected by cold of this kind.,"Dette medfører, at det er nødvendigt også at tage hensyn til, hvordan materiale og emballage påvirkes af kulden."
"It is good that, in establishing the present regulations, we can also be flexible.","Hr. formand, det er positivt, at vi i forbindelse med denne ordning også kan være fleksible."
I hope that the Commission is able to accept the present amendment.,"Jeg håber, at Kommissionen kan acceptere denne ændring."
"Mr President, I would like to thank not only Mr Koch, but also the Vice-President of the Commission for the clear and unambiguous way in which they have declared their support for safety in the transport sector and acknowledged it as a priority.","Hr. formand, jeg vil ikke kun takke hr. Koch, men også næstformanden for Kommissionen for, at de begge har bekendt sig så klart og tydeligt til sikkerheden på transportområdet og til prioriteringen af sikkerheden."
The reason Mr Koch produced his sound report was because the work in the CEN and within the United Nations Economic Commission was proceeding none too expeditiously.,"Hr. Koch har udarbejdet en udmærket betænkning, fordi arbejdet i CEN og også inden for rammerne af FN's Økonomiske Kommission ikke er blevet udført så hurtigt."
"I would like to ask the Vice-President if she is in a position to tell us today what the state of play is with regard to the efforts towards harmonisation being made by these two organisations, and whether the EU is in a position to hasten these harmonisation efforts, in accordance with principles that are as simple as possible.","Jeg vil gerne spørge næstformanden, om hun kan sige os i dag, hvordan det står til med hensyn til de to organisationers harmoniseringsbestræbelser, og om EU har mulighed for at fremskynde harmoniseringsbestræbelserne efter så enkle principper som muligt."
"For one thing is clear: even if we come to an excellent arrangement within the European Union, traffic does not stop at our borders, it goes beyond them.","For følgende står klart: Selvom vi fastsætter usædvanlige bestemmelser inden for Den Europæiske Union, stopper trafikken ikke ved disse grænser, den overskrider dem."
Hence there is certainly every reason to introduce more far-reaching regional provisions.,"Derfor er vidtgående, det vil sige regionalt vidtgående bestemmelser helt sikkert meningsfulde."
If the Commissioner is unable to do so today then would she be prepared to inform the committee in writing of how matters stand and what stage negotiations between the CEN and the Economic Commission are at?,"Hvis kommissæren ikke kan gøre det i dag, er hun så rede til at sende oplysningerne om situationen og forhandlingerne mellem CEN og Den Økonomiske Kommission til udvalget skriftligt?"
"Mr President, I would once again like to congratulate Mr Koch on his magnificent work on this other report, which in a way supplements the debate which we held in October on rail transport.","Hr. formand, jeg lykønsker igen hr. Koch med hans arbejde med denne anden betænkning, som på en måde supplerer den forhandling, vi havde i oktober om jernbanetransport."
"We all regret that the European Committee for Standardisation (CEN) has not been able, in the required time, to carry out the amendment of the provisions necessary for the required harmonisation within the European Union.","Vi beklager alle, at Den Europæiske Standardiseringsorganisation (CEN) ikke har været i stand til inden for den fastsatte tid at gennemføre den ændring af bestemmelser, der er nødvendig for en passende harmonisering inden for Den Europæiske Union."
This debate and the amendment of the directive currently in force allow us to incorporate differentiating elements which demonstrate the diversity of this Europe of ours.,"Denne forhandling og ændringen af det gældende direktiv giver os mulighed for at inddrage forskellige forhold, som er et udtryk for Europas mangfoldighed."
"A moment ago, Mr Vatanen spoke to us of lower temperatures, not of 20 degrees below zero, but of 40 degrees below zero.","For et øjeblik siden fortalte hr. Vatanen os om temperaturer på under ikke -20ºC, men -40ºC."
"Of course, we accept that amendment - it is absolutely right - and I believe that we should incorporate specific circumstances which demonstrate the climatic diversity of the European Union, which sometimes take the form of specifics and of concrete requirements for the establishment of standards and characterisations of a technical nature.","Naturligvis accepterer vi det ændringsforslag, det er helt berettiget, og jeg mener, at det er nødvendigt at inddrage konkrete forhold, der er et udtryk for den klimatiske variation i Den Europæiske Union, og som af og til giver sig udslag i konkrete specifikationer og krav, når der skal tages stilling til standardisering eller karakterisering af teknisk art."
"I would like to say, with regard to Mr Swoboda' s comments on the activity of the CEN, that we are urging them to speed up their work as much as possible because it would be terrible if, despite the new deadline, we were to find ourselves after a year and a bit with the same difficulties because their work has not been concluded.","I forbindelse med hr. Swobodas kommentarer hvad angår aktiviteterne i CEN, vil jeg sige, at vi presser på, for at de fremskynder deres arbejde mest muligt, for det ville være katastrofalt, hvis vi, på trods af den nye frist, om lidt over et år stod over for de samme problemer, fordi arbejdet ikke var afsluttet."
"Lastly, Mr President, the basic problems justifying this amendment of the directive have been pointed out.","Endelig, hr. formand, er der allerede blevet nævnt grundlæggende problemer, der retfærdiggør denne ændring af direktivet."
"We have referred to the delay by the CEN, the amendment of certain provisions, the consistency between the text of the directive and the content of the annexes and the need to for it to be more specific.","Vi har talt om forsinkelsen i CEN, ændringen af nogle bestemmelser, sammenhængen mellem direktivets tekst og indholdet af bilagene, behovet for større præcision."
"The Commission accepts all of the contributions of the parliamentary committee and the rapporteur, Mr Koch, which are contained in the various amendments, specifically four.","Alle bidragene fra det parlamentariske udvalg og fra ordføreren, hr. Koch, som er kommet til udtryk i forskellige ændringsforslag, nærmere betegnet fire, er blevet godkendt af Kommissionen."
We therefore accept the four amendments which have been proposed.,"Vi accepterer altså de fire ændringsforslag, som er blevet fremsat."
The debate is closed.,Forhandlingen er afsluttet.
The vote will take place tomorrow at 12 p.m.,Afstemningen finder sted i morgen kl. 12.00.
Structural Funds - Cohesion Fund coordination,Samordning strukturfondene/Samhørighedsfonden
"The next item is the report (A5-0108/1999) by Mrs Schroedter, on behalf of the Committee on Regional Policy, Transport and Tourism, on the communication from the Commission in the field of the Structural Funds and their coordination with the Cohesion Fund: guidelines for programmes in the period 2000-2006 [COM(1999)344 - C5-0122/1999 - 1999/2127(COS)].","Næste punkt på dagsordenen er betænkning (A5-0108/1999) af Schroedter for Udvalget om Regionalpolitik, Transport og Turisme om meddelelse fra Kommissionen om strukturfondene og deres samordning med Samhørighedsfonden - Retningslinjer for programmer for perioden 2000-2006 (KOM(1999)344 - C5-0122/1999 - 1999/2127(COS))."
"Mr President, it is particularly pleasing for me to make my first speech in the European Parliament on what is regarded as the most important issue within that part of the United Kingdom that I represent in this Parliament, namely Wales.",") Hr. formand, det er en særlig glæde for mig at holde min første tale i Europa-Parlamentet om noget, der betragtes som det væsentligste spørgsmål inden for den del af Det Forenede Kongerige, som jeg repræsenterer her i Parlamentet, nemlig Wales."
"A major part of Wales, as you know, has been granted Objective 1 status under the Structural Funds programme.","En stor del af Wales har, som mange ved, opnået status som mål 1-område under programmet om strukturfondene."
It is quite clear that many people within Wales are looking to the European Structural Funds programme to alleviate some of the great difficulties that we undoubtedly face.,"Det er helt klart, at mange i Wales forventer, at det europæiske strukturfondsprogram vil afhjælpe nogle af de problemer, som vi utvivlsomt vil møde."
We have seen poverty growing in Wales; and growing still further since 1997.,"Der er stigende fattigdom i Wales, endnu mere end i 1997."
We have seen the gap between rich and poor widen.,Afgrunden mellem rige og fattige vokser.
"We are looking, therefore, within the Structural Funds programme not just to see industrial restructuring but also to see a wider improvement in the whole of the economic base within the Principality.","Derfor håber vi med strukturfondsprogrammet ikke blot at opnå en industriel omstrukturering, men også en mere overordnet forbedring af hele det økonomiske fundament inden for det pågældende område."
"What is, however, deeply damaging for us is the belief that in some way the granting of Structural Funds assistance is something that has been, in a sense, a success of the government.","Det, der er meget skadeligt for os, er opfattelsen af, at støttten fra strukturfondene skyldes regeringens succes."
It is sadly only a recognition of the very great difficulties that Wales faces.,"Det er desværre en sørgelig erkendelse af de store vanskeligheder, som Wales oplever."
That is why I want to highlight some of the issues that I believe the Commission must have at the forefront.,"Derfor ønsker jeg at fremhæve nogle af de spørgsmål, som jeg mener, at Kommissionen skal fokusere mest på."
We look to the Commission to deal with points in relation to additionality.,"Vi forventer, at Kommissionen tager sig af spørgsmål i forbindelse med additionsprincippet."
We are dissatisfied with the fact that those figures seem to have been in some way hidden within UK figures.,"Vi er utilfredse med, at tallene på en eller anden måde har været skjult i tallene for Det Forenede Kongerige."
We look to the Commission also to ensure that there is matched funding for projects.,"Vi forventer endvidere, at Kommissionen også sikrer, at der er ""matched funding"" til projekterne."
"We look to it to challenge the UK Government, to ensure that the private sector, which surely must be providing the major impetus for Structural Funds expenditure, is involved in the planning stage.","Vi håber, at Kommissionen vil udfordre den britiske regering for at sikre, at den private sektor, der helt sikkert må være den største aftager af strukturfondsudgifter, inddrages på planlægningsstadiet."
"Finally, we ask that the Commission ensures that Structural Fund monies are spent in a way which is transparent.","Endelig anmoder vi om, at Kommissionen sikrer, at pengene fra strukturfondene anvendes på en gennemsigtig måde."
Too much of what takes place within this Parliament is not transparent.,"Alt for meget af det, der foregår i Parlamentet, er uigennemsigtigt."
This is one area in which I believe the Commission can be a very great friend to Wales.,"På dette område tror jeg, at Kommissionen kan være en rigtig god ven for Wales."
"Mr President, our committee views these issues very differently and, to start, I will speak from the point of view of research.","Hr. formand, vores udvalg behandler disse sager ud fra mange forskellige aspekter, og først taler jeg om aspektet forskning."
"We see it as a very positive sign that, in her own conclusions, the rapporteur has taken account of our committee' s proposal that the Cohesion Fund countries should broaden the research infrastructure by locating universities and colleges in such a way that they would serve those who live in undeveloped regions better than now and make it easier for educated people to remain in their home districts.","Vi mener, at det er meget positivt, at ordføreren har taget forslaget fra vores udvalg om, at forskningsinfrastrukturen udbygges navnlig i samhørighedslande, ved at højskoler og læreanstalter placeres, således at de i højere grad kan komme indbyggerne i de mindre udviklede regioner til gode og gøre det lettere for veluddannede at blive boende på deres hjemegn, med i sine egne konklusioner."
"This will be possible with action on the part of governments, and such decentralisation of higher education will be an unquestionably useful policy in evening out development.","Dette er muligt gennem offentlige foranstaltninger, og den type decentralisering af de højere uddannelser er uden tvivl gavnlig politik for at opnå en mere ligelig udvikling."
"Another matter we would like to address, specifically from the point of view of industrial policy, is that we would have liked the Commission to pay more attention to the effects of services, electronic commerce and the growing use of the Internet, when they were planning the coordination of Structural Funds and Cohesion Funds.","Et andet aspekt, som vi gerne vil påpege navnlig ud fra industripolitiske synspunkter, er, at vi gerne ville have haft, at Kommissionen ved planlægningen af samordning af strukturfonden og Samhørighedsfonden tager mere hensyn til påvirkninger fra vækst i anvendelsen af tjenester, elektronisk handel og Internet."
Poverty and wealth used to depend more on means of livelihood.,Tidligere var fattigdom og rigdom i højere grad afhængig af erhvervsstrukturer.
"The rich areas were those where there were jobs in industry, but today those areas might have become a burden, and they may well be poor, meaning we also have to invest in new sectors of industry such as electronic production, as I might call it, and the production of services, because they are the industries of the future.","De regioner, hvor der var arbejdspladser i industrien, var rige, men i dag er disse regioner måske blevet til en belastning og er eventuelt fattige, så der også skal investeres i nye erhvervsområder, såkaldt elektronisk produktion og serviceproduktion, for de er fremtidens erhvervsområder."
"In my opinion the committee drafting the report has not taken sufficient account of this, so on behalf of the Committee on Industry, External Trade, Research and Energy, I would draw the Commission' s attention to this issue.","Dette har udvalget, som udarbejdede betænkningen, efter min mening ikke taget tilstrækkeligt højde for i sin egen betænkning, så på vegne af Udvalget om Industripolitik, Eksterne Økonomiske Forbindelser, Forskning og Energi påpeger jeg dette for Kommissionen."
